type,exclude,authors_full,date,title,abstract,tldr,publication,volume,pages,doi,venue,venue_abbrev,short_title,prof_venue,award,url,pdf,materials,ebook,blog,full_talk,full_talk_embed,teaser_video,teaser_video_embed,bibtex,short_cv,professional_2_page,featured,image,project,doctoral_dissertation,sigchi_description,sigchi_award_description
conference paper,NA,"Ethan S. Hurwitz, Timothy Brady, Adena Schachner",2019-07-27,Detecting social transmission in the design of artifacts via inverse planning,"How do people use human-made objects (artifacts) to learn about the people and actions that created them? We test the richness of people’s reasoning in this domain, focusing on the task of judging whether social transmission has occurred (i.e. whether one person copied another). We develop a formal model of this reasoning process as a form of rational inverse planning, which predicts that rather than solely focusing on artifacts’ similarity to judge whether copying occurred, people should also take into account availability constraints (the materials available), and functional constraints (which materials work). Using an artifact-building task where two characters build tools to solve a puzzle box, we find that this inverse planning model predicts trial-by-trial judgments, whereas simpler models that do not consider availability or functional constraints do not. This suggests people use a process like inverse planning to make flexible inferences from artifacts’ features about the source of design ideas.",NA,Proceedings of the 41st Annual Conference of the Cognitive Science Society,NA,457-463,NA,"Monteal, CA: Cognitive Science Society",NA,NA,NA,NA,https://cogsci.mindmodeling.org/2019/papers/0098/index.html,https://cogsci.mindmodeling.org/2019/papers/0098/0098.pdf,NA,NA,NA,NA,NA,NA,NA,NA,NA,NA,NA,NA,NA,NA,NA,NA
NA,NA,NA,NA,NA,NA,NA,NA,NA,NA,NA,NA,NA,NA,NA,NA,NA,NA,NA,NA,NA,NA,NA,NA,NA,NA,NA,NA,NA,NA,NA,NA,NA,NA
conference talk,NA,"Ethan S. Hurwitz, Timothy Brady, Adena Schachner",2019-07-27,Detecting Social Transmission in the Design of Artifacts Via Inverse Planning,NA,NA,[Cognitive Science Society](https://cogsci.mindmodeling.org/2019/),NA,NA,NA,"Montreal, QC",NA,NA,NA,NA,NA,NA,NA,NA,NA,NA,NA,NA,NA,NA,NA,NA,NA,NA,NA,NA,NA,NA
poster,NA,"Ethan S. Hurwitz, Adena Schachner",2020-07-30,People use inverse planning to rationally seek social information from objects,"People use objects to make social judgments about traits of owners. Do people seek social information in a rational way suggestive of Bayesian inverse planning? In two experiments, participants aimed to learn about a stranger. Each trial showed two sets of objects; the stranger had chosen one from each set, but their choice was hidden. Participants judged which would help them learn more about the stranger: Revealing their choice from set A or B? Participants selected sets rationally, identifying sets with a greater range of options as more informative: Larger sets over smaller; sets varying in style over sets varying only in color (Exp.1). Participants also took into account constraints: They chose sets as more informative when all options were functional vs. when some were not (Exp.2). People consider the generative process behind objects’ selection, using inverse planning to reason about the informational value of others’ objects.",NA,[Cognitive Science Society](https://cogsci.mindmodeling.org/2020/),NA,NA,NA,Virtual Meeting,NA,NA,NA,NA,https://cogsci.mindmodeling.org/2020/papers/0252/index.html,NA,NA,NA,NA,NA,NA,NA,NA,NA,NA,NA,NA,NA,NA,NA,NA,NA
poster,NA,"Alan K. Davis, John M. Clifton, Ethan S. Hurwitz, Roland R. Griffiths",2018-12-01,"Examining the acute subjective and persisting effects occasioned by N,N-dimethyltryptamine (DMT): A latent class analysis",NA,NA,Johns Hopkins Bayview Research Symposium,NA,NA,NA,"Baltimore, MD",NA,NA,NA,NA,NA,NA,NA,NA,NA,NA,NA,NA,NA,NA,NA,NA,NA,NA,NA,NA,NA,NA
poster,NA,"Ethan S. Hurwitz, Robert Jesse, Matthew W. Johnson, Roland R. Griffiths",2017-04-20,A comparison of psilocybin-occasioned vs. naturally-occurring experiences of personal encounters with the divine,NA,NA,[Psychedelic Science](https://2017.psychedelicscience.org/conference/poster-sessions),NA,NA,NA,"Oakland, CA",NA,NA,NA,NA,NA,NA,NA,NA,NA,NA,NA,NA,NA,NA,NA,NA,NA,NA,NA,NA,NA,NA
